{
  "schema_id": "urn:golib:cohesion:schema-v3-decision-freeze:v1",
  "schema_version": 1,
  "decision": {
    "path": ".ai/cohesion/phase3/SCHEMA_V3_DECISIONS.md",
    "bytes_sha256": "sha256:cfa83030b1b05535148292c4db063edaa35aca861e957ecd5579008090059e2f"
  },
  "contract": {
    "repository": "github.com/faustbrian/go-library-tools",
    "path": "docs/ecosystem/goals/cohesion-v1.md",
    "tag": "v1.5.5",
    "tag_object_sha": "6e54f464376865a60c618cce8f07fe70bcfabed0",
    "peeled_commit": "66d2874dc98afe43dd7dad379d6f5e7d1b613111",
    "bytes_sha256": "sha256:6e5ac948c2cf1ec439fdf90c53c0648befb74a65c3eca2eb595737ee8211891c"
  },
  "decision_review": {
    "path": ".ai/cohesion/phase3/SCHEMA_V3_DECISION_REVIEW.json",
    "bytes_sha256": "sha256:c371d51fc8bf5b314d8c7cf51e8b96b7d4714397145cce09cc723f8370fa628d"
  },
  "review_count": 3,
  "reviews": [
    {
      "reviewer_id": "/root/schema_v6_contract_review",
      "dimension": "contract",
      "outcome": "accepted-no-findings",
      "reviewed_sha256": "sha256:cfa83030b1b05535148292c4db063edaa35aca861e957ecd5579008090059e2f"
    },
    {
      "reviewer_id": "/root/schema_v6_execution_review",
      "dimension": "execution-adversary",
      "outcome": "accepted-no-findings",
      "reviewed_sha256": "sha256:cfa83030b1b05535148292c4db063edaa35aca861e957ecd5579008090059e2f"
    },
    {
      "reviewer_id": "/root/schema_v6_verification_review",
      "dimension": "verification",
      "outcome": "accepted-no-findings",
      "reviewed_sha256": "sha256:cfa83030b1b05535148292c4db063edaa35aca861e957ecd5579008090059e2f"
    }
  ],
  "created_at": "2026-09-08T06:39:09Z"
}
